image_url,UPC,Product Type,Price (excl. tax),Price (incl. tax),Tax,Availability,Number of reviews,product_page_url,title,product_description,category_name
https://books.toscrape.com/media/cache/86/38/8638ba095b3b32e0abdef170e7bc4fd6.jpg,c7b5183f4d1d4efe,Books,44.10,44.10,0.00,In stock (15 available),0,https://books.toscrape.com/catalogue/the-murder-of-roger-ackroyd-hercule-poirot-4_852/index.html,The Murder of Roger Ackroyd (Hercule Poirot #4),"In the village of King's Abbot, a widow's sudden suicide sparks rumors that she murdered her first husband, was being blackmailed, and was carrying on a secret affair with the wealthy Roger Ackroyd. The following evening, Ackroyd is murdered in his locked study--but not before receiving a letter identifying the widow's blackmailer. King's Abbot is crawling with suspects, i In the village of King's Abbot, a widow's sudden suicide sparks rumors that she murdered her first husband, was being blackmailed, and was carrying on a secret affair with the wealthy Roger Ackroyd. The following evening, Ackroyd is murdered in his locked study--but not before receiving a letter identifying the widow's blackmailer. King's Abbot is crawling with suspects, including a nervous butler, Ackroyd's wayward stepson, and his sister-in-law, Mrs. Cecil Ackroyd, who has taken up residence in the victim's home. It's now up to the famous detective Hercule Poirot, who has retired to King's Abbot to garden, to solve the case of who killed Roger Ackroyd--a task in which he is aided by the village doctor and narrator, James Sheppard, and by Sheppard's ingenious sister, Caroline.The Murder of Roger Ackroyd is the book that made Agatha Christie a household name and launched her career as a perennial bestseller. Originally published in 1926, it is a landmark in the mystery genre. It was in the vanguard of a new class of popular detective fiction that ushered in the modern era of mystery novels. ...more",Mystery
https://books.toscrape.com/media/cache/e6/dc/e6dcc8f75214eb14edc1ce09c98f3d71.jpg,3bc89353f7e3a3cc,Books,54.21,54.21,0.00,In stock (14 available),0,https://books.toscrape.com/catalogue/the-last-mile-amos-decker-2_754/index.html,The Last Mile (Amos Decker #2),"In his #1 New York Times bestseller Memory Man, David Baldacci introduced the extraordinary detective Amos Decker-the man who can forget nothing. Now, Decker returns in a spectacular new thriller . . . THE LAST MILEConvicted murderer Melvin Mars is counting down the last hours before his execution--for the violent killing of his parents twenty years earlier--when he's gran In his #1 New York Times bestseller Memory Man, David Baldacci introduced the extraordinary detective Amos Decker-the man who can forget nothing. Now, Decker returns in a spectacular new thriller . . . THE LAST MILEConvicted murderer Melvin Mars is counting down the last hours before his execution--for the violent killing of his parents twenty years earlier--when he's granted an unexpected reprieve. Another man has confessed to the crime.Amos Decker, newly hired on an FBI special task force, takes an interest in Mars's case after discovering the striking similarities to his own life: Both men were talented football players with promising careers cut short by tragedy. Both men's families were brutally murdered. And in both cases, another suspect came forward, years after the killing, to confess to the crime. A suspect who may or may not have been telling the truth.The confession has the potential to make Melvin Mars--guilty or not--a free man. Who wants Mars out of prison? And why now?But when a member of Decker's team disappears, it becomes clear that something much larger--and more sinister--than just one convicted criminal's life hangs in the balance. Decker will need all of his extraordinary brainpower to stop an innocent man from being executed. ...more",Mystery
https://books.toscrape.com/media/cache/23/b8/23b81994234ac127d701db1531a08e48.jpg,0c7b9cf2b7662b65,Books,13.92,13.92,0.00,In stock (14 available),0,https://books.toscrape.com/catalogue/that-darkness-gardiner-and-renner-1_743/index.html,That Darkness (Gardiner and Renner #1),"As a forensic investigator for the Cleveland Police Department, Maggie Gardiner has seen her share of Jane Does. The latest is an unidentified female in her early teens, discovered in a local cemetery. More shocking than the girl’s injuries—for Maggie at least—is the fact that no one has reported her missing. She and the detectives assigned to the case (including her cop e As a forensic investigator for the Cleveland Police Department, Maggie Gardiner has seen her share of Jane Does. The latest is an unidentified female in her early teens, discovered in a local cemetery. More shocking than the girl’s injuries—for Maggie at least—is the fact that no one has reported her missing. She and the detectives assigned to the case (including her cop ex-husband) are determined to follow every lead, run down every scrap of evidence. But the monster they seek is watching each move, closer to them than they could ever imagine. Jack Renner is a killer. He doesn’t murder because he savors it, or because he believes himself omnipotent, or for any reason other than to make the world a safer place. When he follows the trail of this Jane Doe to a locked room in a small apartment where eighteen teenaged girls are anything but safe, he knows something must be done. But his pursuit of their captor takes an unexpected turn.Maggie Gardiner finds another body waiting for her in the autopsy room—and a host of questions that will challenge everything she believes about justice, morality, and the true nature of evil … ...more",Mystery
https://books.toscrape.com/media/cache/74/9b/749bca168778cf35fdb2441a9d6b403f.jpg,2d1e337aaf341858,Books,10.69,10.69,0.00,In stock (14 available),0,https://books.toscrape.com/catalogue/tastes-like-fear-di-marnie-rome-3_742/index.html,Tastes Like Fear (DI Marnie Rome #3),"Sarah Hilary won the 2015 Theakston's Crime Novel of the Year with her debut, the 2014 Richard and Judy pick SOMEONE ELSE'S SKIN. She followed up with NO OTHER DARKNESS, proclaimed as 'riveting' by Lisa Gardner and 'truly mesmerising' by David Mark. Now D.I. Marnie Rome returns in her third novel.Home is where Harm lies...The young girl who causes the fatal car crash disap Sarah Hilary won the 2015 Theakston's Crime Novel of the Year with her debut, the 2014 Richard and Judy pick SOMEONE ELSE'S SKIN. She followed up with NO OTHER DARKNESS, proclaimed as 'riveting' by Lisa Gardner and 'truly mesmerising' by David Mark. Now D.I. Marnie Rome returns in her third novel.Home is where Harm lies...The young girl who causes the fatal car crash disappears from the scene.A runaway who doesn't want to be found, she only wants to go home.To the one man who understands her.Gives her shelter. Just as he gives shelter to the other lost girls who live in his house.He's the head of her new family.He's Harm. And when Harm's family is threatened, Marnie Rome is about to find out that everything tastes like fear... ...more",Mystery
https://books.toscrape.com/media/cache/f1/37/f137a410ed7d6fcfce17d081caf97915.jpg,4416c474713ec1f5,Books,48.35,48.35,0.00,In stock (14 available),0,https://books.toscrape.com/catalogue/a-time-of-torment-charlie-parker-14_657/index.html,A Time of Torment (Charlie Parker #14),"Jerome Burnel was once a hero. He intervened to prevent multiple killings and in doing so damned himself. His life was torn apart. He was imprisoned, brutalized.But in his final days, with the hunters circling, he tells his story to private detective Charlie Parker. He speaks of the girl who was marked for death but was saved, of the ones who tormented him, and an entity t Jerome Burnel was once a hero. He intervened to prevent multiple killings and in doing so damned himself. His life was torn apart. He was imprisoned, brutalized.But in his final days, with the hunters circling, he tells his story to private detective Charlie Parker. He speaks of the girl who was marked for death but was saved, of the ones who tormented him, and an entity that hides in a ruined stockade.Parker is not like other men. He died, and was reborn. He is ready to wage war.Now he will descend upon a strange, isolated community called the Cut, and face down a force of men who rule by terror, intimidation, and murder.All in the name of the being they serve.All in the name of the Dead King. ...more",Mystery
https://books.toscrape.com/media/cache/27/40/274003f2720f82844873945b87af6c19.jpg,63ee5bc46066a8a8,Books,16.73,16.73,0.00,In stock (14 available),0,https://books.toscrape.com/catalogue/a-study-in-scarlet-sherlock-holmes-1_656/index.html,A Study in Scarlet (Sherlock Holmes #1),"In the debut of literature's most famous sleuth, a dead man is discovered in a bloodstained room in Brixton. The only clues are a wedding ring, a gold watch, a pocket edition of Boccaccio's Decameron, and a word scrawled in blood on the wall. With this investigation begins the partnership of Sherlock Holmes and Dr. Watson. Their search for the murderer uncovers a story of In the debut of literature's most famous sleuth, a dead man is discovered in a bloodstained room in Brixton. The only clues are a wedding ring, a gold watch, a pocket edition of Boccaccio's Decameron, and a word scrawled in blood on the wall. With this investigation begins the partnership of Sherlock Holmes and Dr. Watson. Their search for the murderer uncovers a story of love and revenge-and heralds a franchise of detective mysteries starring the formidable Holmes. ...more",Mystery
https://books.toscrape.com/media/cache/8d/52/8d52227d29e03695ef755620078b7815.jpg,abdd91e96515a617,Books,26.80,26.80,0.00,In stock (12 available),0,https://books.toscrape.com/catalogue/poisonous-max-revere-novels-3_627/index.html,Poisonous (Max Revere Novels #3),"Teen-aged Internet bully Ivy Lake fell off a cliff and few people cared ... except her mentally-challenged eighteen-year-old step-brother, Tommy. He loved her in spite of her cruelty. He's distraught and doesn't understand why his blended family is falling apart. After a year, the police still have no answers: Ivy could have jumped, could have been pushed, or it could have Teen-aged Internet bully Ivy Lake fell off a cliff and few people cared ... except her mentally-challenged eighteen-year-old step-brother, Tommy. He loved her in spite of her cruelty. He's distraught and doesn't understand why his blended family is falling apart. After a year, the police still have no answers: Ivy could have jumped, could have been pushed, or it could have been an accident. With too many suspects and not enough evidence, the investigation has grown cold.Tommy thinks that if someone can figure out what happened to his step-sister, everything will go back to normal, so he writes to investigative reporter Maxine Revere. This isn’t the type of case Max normally takes on, but the heartbreak and simple honesty in Tommy's letter pulls her in. She travels to Corte Madera, California, with her assistant David Kane and is at first pleased that the police are cooperative. But the more Max learns about Tommy and his dysfunctional family, the more she thinks she’s taken on an impossible task: this may be the one case she can’t solve.If Ivy was murdered, it was exceptionally well-planned and that kind of killer could be hiding in plain sight ... planning the next act of violence. Max believes the truth is always better than lies, that the truth is the only thing that matters to gain justice for victims and their families. But for the first time, she wonders if this time, the truth will kill. ...more",Mystery
https://books.toscrape.com/media/cache/19/74/19748437aac103dbdeb1918062728726.jpg,e7fe3bf2768602cf,Books,54.36,54.36,0.00,In stock (12 available),0,https://books.toscrape.com/catalogue/murder-at-the-42nd-street-library-raymond-ambler-1_624/index.html,Murder at the 42nd Street Library (Raymond Ambler #1),"Murder at the 42nd Street Library opens with a murder in a second floor office of the iconic, beaux-arts flagship of the New York Public Library. Ray Ambler, the curator of the library's crime fiction collection, joins forces with NYPD homicide detective Mike Cosgrove in hopes of bringing a murderer to justice.In his search for the reasons behind the murder, Ambler uncover Murder at the 42nd Street Library opens with a murder in a second floor office of the iconic, beaux-arts flagship of the New York Public Library. Ray Ambler, the curator of the library's crime fiction collection, joins forces with NYPD homicide detective Mike Cosgrove in hopes of bringing a murderer to justice.In his search for the reasons behind the murder, Ambler uncovers hidden--and profoundly disturbing--relationships between visitors to the library. These include a celebrated mystery writer who has donated his papers to the library's crime fiction collection, that writer's missing daughter, a New York society woman with a hidden past, and one of Ambler's colleagues at the world-famous library. Those shocking revelations lead inexorably to the tragic and violent events that follow. ...more",Mystery
https://books.toscrape.com/media/cache/fa/b5/fab5e650b19b76c5f5d1ce3a626376b1.jpg,c039f5aceb093537,Books,35.28,35.28,0.00,In stock (12 available),0,https://books.toscrape.com/catalogue/most-wanted_623/index.html,Most Wanted,"Lisa Scottoline delivers another searing, powerful blockbuster novel that explores hot-button issues within the framework of an intricately plotted thriller. When a woman and her husband, desperate for a baby, find themselves unable to conceive, they decide to take further steps. Since it is the husband who is infertile, the heroine decides to use a donor. And all seems to Lisa Scottoline delivers another searing, powerful blockbuster novel that explores hot-button issues within the framework of an intricately plotted thriller. When a woman and her husband, desperate for a baby, find themselves unable to conceive, they decide to take further steps. Since it is the husband who is infertile, the heroine decides to use a donor. And all seems to be well. Three months pass and she is happily pregnant. But a shocking revelation occurs when she discovers that a man arrested for a series of brutal murders is her donor - the biological father of the child she is carrying. Delving deeper to uncover the truth, the heroine must face her worst fears, and confront a terrifying truth. Most Wanted is sure to be Lisa Scottoline's most discussed, bestselling novel yet. ...more",Mystery
https://books.toscrape.com/media/cache/b2/c5/b2c501b848bccd9cc375771f53c0fb6e.jpg,bddc6fd036eb6279,Books,11.84,11.84,0.00,In stock (12 available),0,https://books.toscrape.com/catalogue/hide-away-eve-duncan-20_620/index.html,Hide Away (Eve Duncan #20),"Iris Johansen's beloved forensic sculptor Eve Duncan is back and now the stakes are higher than ever. Dramatic changes are on the horizon for Eve and Joe Quinn and their relationship may never be the same. Faced with the task of protecting Cara Delaney, a young girl with ruthless enemies who want to see her dead, Eve takes her away to the remote Scottish Highlands where th Iris Johansen's beloved forensic sculptor Eve Duncan is back and now the stakes are higher than ever. Dramatic changes are on the horizon for Eve and Joe Quinn and their relationship may never be the same. Faced with the task of protecting Cara Delaney, a young girl with ruthless enemies who want to see her dead, Eve takes her away to the remote Scottish Highlands where they join Jane MacGuire in search of a hidden treasure. But nowhere is far enough away to protect Cara from danger. With enemies closing in from all sides, Hide Away is a high-octane thriller that fans will not want to miss. ...more",Mystery
https://books.toscrape.com/media/cache/91/8c/918c2c95ae90495cdb0371a22b726d82.jpg,49b24c6a41b82bd2,Books,59.48,59.48,0.00,In stock (12 available),0,https://books.toscrape.com/catalogue/boar-island-anna-pigeon-19_613/index.html,Boar Island (Anna Pigeon #19),"Bringing you a gripping mystery, Nevada Barr transports you to the wild and dangerous landscapes of America's National Parks and is sure to appeal if you like Sue Grafton and Janet Evanovich.The eighteenth sensational crime novel from New York Times bestselling author Nevada Barr featuring fearless park ranger Anna Pigeon as she battles to solve a heinous crime set amidst Bringing you a gripping mystery, Nevada Barr transports you to the wild and dangerous landscapes of America's National Parks and is sure to appeal if you like Sue Grafton and Janet Evanovich.The eighteenth sensational crime novel from New York Times bestselling author Nevada Barr featuring fearless park ranger Anna Pigeon as she battles to solve a heinous crime set amidst the wild and dangerous landscape of a US National Park. ...more",Mystery
https://books.toscrape.com/media/cache/e4/37/e43737572b04c7ad28b35f3da29eb8dd.jpg,6159d8b187831770,Books,27.26,27.26,0.00,In stock (11 available),0,https://books.toscrape.com/catalogue/the-widow_609/index.html,The Widow,"THE NEW YORK TIMESBESTSELLERFor fans of Gone Girl and The Girl on the Train, an electrifying thriller that will take you into the dark spaces that exist between a husband and a wife.When the police started asking questions, Jean Taylor turned into a different woman. One who enabled her and her husband to carry on, when more bad things began to happen... But that woman’s h THE NEW YORK TIMES BESTSELLERFor fans of Gone Girl and The Girl on the Train, an electrifying thriller that will take you into the dark spaces that exist between a husband and a wife.When the police started asking questions, Jean Taylor turned into a different woman. One who enabled her and her husband to carry on, when more bad things began to happen...   But that woman’s husband died last week. And Jean doesn’t have to be her anymore.   There’s a lot Jean hasn’t said over the years about the crime her husband was suspected of committing. She was too busy being the perfect wife, standing by her man while living with the accusing glares and the anonymous harassment.   Now there’s no reason to stay quiet. There are people who want to hear her story. They want to know what it was like living with that man. She can tell them that there were secrets. There always are in a marriage.   The truth—that’s all anyone wants. But the one lesson Jean has learned in the last few years is that she can make people believe anything… ...more",Mystery
https://books.toscrape.com/media/cache/09/02/0902666ade8ab8183363e53c108e5069.jpg,05a61a3bd8ca4149,Books,13.71,13.71,0.00,In stock (11 available),0,https://books.toscrape.com/catalogue/playing-with-fire_602/index.html,Playing with Fire,"A beautiful violinist is haunted by a very old piece of music she finds in a strange antique shop in Rome.The first time Julia Ansdell picks up The Incendio Waltz, she knows it’s a strikingly unusual composition. But while playing the piece, Julia blacks out and awakens to find her young daughter implicated in acts of surprising violence. And when she travels to Venice to A beautiful violinist is haunted by a very old piece of music she finds in a strange antique shop in Rome.The first time Julia Ansdell picks up The Incendio Waltz, she knows it’s a strikingly unusual composition. But while playing the piece, Julia blacks out and awakens to find her young daughter implicated in acts of surprising violence. And when she travels to Venice to find the previous owner of the music, she uncovers a dark secret that involves dangerously powerful people—a family who would stop at nothing to keep Julia from bringing the truth to light. ...more",Mystery
https://books.toscrape.com/media/cache/2c/68/2c6857eb1c10995c8b9e77a1804f68cd.jpg,9735c969c652dd89,Books,25.37,25.37,0.00,In stock (7 available),0,https://books.toscrape.com/catalogue/what-happened-on-beale-street-secrets-of-the-south-mysteries-2_506/index.html,What Happened on Beale Street (Secrets of the South Mysteries #2),"What Happened on Beale Street is an exciting addition to the Secrets of the South Mysteries from bestselling author Mary Ellis. These standalone, complex crime dramas follow a private investigator's quest to make the world a better place...solving one case at a time.A cryptic plea for help from a childhood friend sends cousins Nate and Nicki Price from New Orleans to Memph What Happened on Beale Street is an exciting addition to the Secrets of the South Mysteries from bestselling author Mary Ellis. These standalone, complex crime dramas follow a private investigator's quest to make the world a better place...solving one case at a time.A cryptic plea for help from a childhood friend sends cousins Nate and Nicki Price from New Orleans to Memphis, the home of scrumptious barbecue and soulful blues music. When they arrive at Danny Andre's last known address, they discover signs of a struggle and a lifestyle not in keeping with the former choirboy they fondly remember.Danny's sister, Isabelle, reluctantly accepts their help. She and Nate aren't on the best of terms due to a complicated past, yet they will have to get beyond that if they want to save Danny.On top of Danny's alarming disappearance and his troubled relationship with Isabelle, Nate also has to rein in his favorite cousin's overzealousness as a new and eager PI. Confronted with a possible murder, mystery, and mayhem in the land of the Delta blues, Nate must rely on his faith and investigative experience to keep one or more of them from getting killed. ...more",Mystery
https://books.toscrape.com/media/cache/38/a4/38a44ac4f642f4717d865c81ec594529.jpg,20789fb17b423c4c,Books,52.30,52.30,0.00,In stock (7 available),0,https://books.toscrape.com/catalogue/the-bachelor-girls-guide-to-murder-herringford-and-watts-mysteries-1_491/index.html,The Bachelor Girl's Guide to Murder (Herringford and Watts Mysteries #1),"In 1910 Toronto, while other bachelor girls perfect their domestic skills and find husbands, two friends perfect their sleuthing skills and find a murderer.Inspired by their fascination with all things Sherlock Holmes, best friends and flatmates Merinda and Jem launch a consulting detective business. The deaths of young Irish women lead Merinda and Jem deeper into the mire In 1910 Toronto, while other bachelor girls perfect their domestic skills and find husbands, two friends perfect their sleuthing skills and find a murderer.Inspired by their fascination with all things Sherlock Holmes, best friends and flatmates Merinda and Jem launch a consulting detective business. The deaths of young Irish women lead Merinda and Jem deeper into the mire of the city's underbelly, where the high hopes of those dreaming to make a new life in Canada are met with prejudice and squalor.While searching for answers, donning disguises, and sneaking around where no proper ladies would ever go, they pair with Jasper Forth, a police constable, and Ray DeLuca, a reporter in whom Jem takes a more than professional interest. Merinda could well be Toronto's premiere consulting detective, and Jem may just find a way to put her bachelor girlhood behind her forever--if they can stay alive long enough to do so. ...more",Mystery
https://books.toscrape.com/media/cache/5c/8a/5c8acde540a88aed464ab5c52bafcd83.jpg,4e980425468708da,Books,20.89,20.89,0.00,In stock (7 available),0,https://books.toscrape.com/catalogue/delivering-the-truth-quaker-midwife-mystery-1_464/index.html,Delivering the Truth (Quaker Midwife Mystery #1),"Quaker midwife Rose Carroll hears secrets and keeps confidences as she attends births of the rich and poor alike in an 1888 Massachusetts mill town. When the town’s world-famed carriage industry is threatened by the work of an arsonist, and a carriage factory owner’s adult son is stabbed to death with Rose's own knitting needle, she is drawn into solving the mystery. Thing Quaker midwife Rose Carroll hears secrets and keeps con­fi­dences as she attends births of the rich and poor alike in an 1888 Massachusetts mill town. When the town’s world-famed car­riage indus­try is threat­ened by the work of an arson­ist, and a car­riage fac­tory owner’s adult son is stabbed to death with Rose's own knitting needle, she is drawn into solv­ing the mys­tery. Things get dicey after the same owner’s mis­tress is also mur­dered, leav­ing her one-week-old baby with­out a mother. The Quaker poet and abolitionist John Greenleaf Whittier helps Rose by lending words of advice and support. While strug­gling with being less than the per­fect Friend, Rose draws on her strengths as a counselor and prob­lem solver to bring two mur­der­ers to justice before they destroy the town’s carriage industry and the people who run it. ...more",Mystery
https://books.toscrape.com/media/cache/6b/61/6b61d393f0731f6c52182ba3cf41e245.jpg,2da5edf8b5776c9a,Books,24.80,24.80,0.00,In stock (6 available),0,https://books.toscrape.com/catalogue/the-mysterious-affair-at-styles-hercule-poirot-1_452/index.html,The Mysterious Affair at Styles (Hercule Poirot #1),"Poirot, a Belgian refugee of the Great War, is settling in England near the home of Emily Inglethorp, who helped him to his new life. His friend Hastings arrives as a guest at her home. When the woman is killed, Poirot uses his detective skills to solve the mystery.",Mystery
