image_url,UPC,Product Type,Price (excl. tax),Price (incl. tax),Tax,Availability,Number of reviews,product_page_url,title,product_description,category_name
https://books.toscrape.com/media/cache/6d/41/6d418a73cc7d4ecfd75ca11d854041db.jpg,a22124811bfa8350,Books,45.17,45.17,0.00,In stock (19 available),0,https://books.toscrape.com/catalogue/its-only-the-himalayas_981/index.html,It's Only the Himalayas,"“Wherever you go, whatever you do, just . . . don’t do anything stupid.” —My MotherDuring her yearlong adventure backpacking from South Africa to Singapore, S. Bedford definitely did a few things her mother might classify as ""stupid."" She swam with great white sharks in South Africa, ran from lions in Zimbabwe, climbed a Himalayan mountain without training in Nepal, and wa “Wherever you go, whatever you do, just . . . don’t do anything stupid.” —My MotherDuring her yearlong adventure backpacking from South Africa to Singapore, S. Bedford definitely did a few things her mother might classify as ""stupid."" She swam with great white sharks in South Africa, ran from lions in Zimbabwe, climbed a Himalayan mountain without training in Nepal, and watched as her friend was attacked by a monkey in Indonesia.But interspersed in those slightly more crazy moments, Sue Bedfored and her friend ""Sara the Stoic"" experienced the sights, sounds, life, and culture of fifteen countries. Joined along the way by a few friends and their aging fathers here and there, Sue and Sara experience the trip of a lifetime. They fall in love with the world, cultivate an appreciation for home, and discover who, or what, they want to become.It's Only the Himalayas is the incredibly funny, sometimes outlandish, always entertaining confession of a young backpacker that will inspire you to take your own adventure. ...more",Travel
https://books.toscrape.com/media/cache/fe/8a/fe8af6ceec7718986380c0fde9b3b34f.jpg,ce60436f52c5ee68,Books,49.43,49.43,0.00,In stock (15 available),0,https://books.toscrape.com/catalogue/full-moon-over-noahs-ark-an-odyssey-to-mount-ararat-and-beyond_811/index.html,Full Moon over Noah’s Ark: An Odyssey to Mount Ararat and Beyond,"Acclaimed travel writer Rick Antonson sets his adventurous compass on Mount Ararat, exploring the region’s long history, religious mysteries, and complex politics.Mount Ararat is the most fabled mountain in the world. For millennia this massif in eastern Turkey has been rumored as the resting place of Noah’s Ark following the Great Flood. But it also plays a significant ro Acclaimed travel writer Rick Antonson sets his adventurous compass on Mount Ararat, exploring the region’s long history, religious mysteries, and complex politics.Mount Ararat is the most fabled mountain in the world. For millennia this massif in eastern Turkey has been rumored as the resting place of Noah’s Ark following the Great Flood. But it also plays a significant role in the longstanding conflict between Turkey and Armenia.Author Rick Antonson joined a five-member expedition to the mountain’s nearly 17,000-foot summit, trekking alongside a contingent of Armenians, for whom Mount Ararat is the stolen symbol of their country. Antonson weaves vivid historical anecdote with unexpected travel vignettes, whether tracing earlier mountaineering attempts on the peak, recounting the genocide of Armenians and its unresolved debate, or depicting the Kurds’ ambitions for their own nation’s borders, which some say should include Mount Ararat.What unfolds in Full Moon Over Noah’s Ark is one man’s odyssey, a tale told through many stories. Starting with the flooding of the Black Sea in 5600 BCE, through to the Epic of Gilgamesh and the contrasting narratives of the Great Flood known to followers of the Judaic, Christian and Islamic religions, Full Moon Over Noah’s Ark takes readers along with Antonson through the shadows and broad landscapes of Turkey, Iraq, Iran and Armenia, shedding light on a troubled but fascinating area of the world. ...more",Travel
https://books.toscrape.com/media/cache/c7/1a/c71a85dbf8c2dbc75cb271026618477c.jpg,f9705c362f070608,Books,48.87,48.87,0.00,In stock (14 available),0,https://books.toscrape.com/catalogue/see-america-a-celebration-of-our-national-parks-treasured-sites_732/index.html,See America: A Celebration of Our National Parks & Treasured Sites,"To coincide with the 2016 centennial anniversary of the National Parks Service, the Creative Action Network has partnered with the National Parks Conservation Association to revive and reimagine the legacy of WPA travel posters. Artists from all over the world have participated in the creation of this new, crowdsourced collection of See America posters for a modern era. Fe To coincide with the 2016 centennial anniversary of the National Parks Service, the Creative Action Network has partnered with the National Parks Conservation Association to revive and reimagine the legacy of WPA travel posters. Artists from all over the world have participated in the creation of this new, crowdsourced collection of See America posters for a modern era. Featuring artwork for 75 national parks and monuments across all 50 states, this engaging keepsake volume celebrates the full range of our nation's landmarks and treasured wilderness. ...more",Travel
https://books.toscrape.com/media/cache/ca/30/ca30b1afe1e76ce7ba1db8176d398e53.jpg,1809259a5a5f1d8d,Books,36.94,36.94,0.00,In stock (8 available),0,https://books.toscrape.com/catalogue/vagabonding-an-uncommon-guide-to-the-art-of-long-term-world-travel_552/index.html,Vagabonding: An Uncommon Guide to the Art of Long-Term World Travel,"With a new foreword by Tim Ferriss •There’s nothing like vagabonding: taking time off from your normal life—from six weeks to four months to two years—to discover and experience the world on your own terms. In this one-of-a-kind handbook, veteran travel writer Rolf Potts explains how anyone armed with an independent spirit can achieve the dream of extended overseas travel. With a new foreword by Tim Ferriss • There’s nothing like vagabonding: taking time off from your normal life—from six weeks to four months to two years—to discover and experience the world on your own terms. In this one-of-a-kind handbook, veteran travel writer Rolf Potts explains how anyone armed with an independent spirit can achieve the dream of extended overseas travel. Now completely revised and updated, Vagabonding is an accessible and inspiring guide to   • financing your travel time • determining your destination • adjusting to life on the road • working and volunteering overseas • handling travel adversity • re-assimilating back into ordinary life  Praise for Vagabonding  “A crucial reference for any budget wanderer.”—Time  “Vagabonding easily remains in my top-10 list of life-changing books. Why? Because one incredible trip, especially a long-term trip, can change your life forever. And Vagabonding teaches you how to travel (and think), not just for one trip, but for the rest of your life.”—Tim Ferriss, from the foreword   “The book is a meditation on the joys of hitting the road. . . . It’s also a primer for those with a case of pent-up wanderlust seeking to live the dream.”—USA Today   “I couldn’t put this book down. It’s a whole different ethic of travel. . . . [Potts’s] practical advice might just convince you to enjoy that open-ended trip of a lifetime.”—Rick Steves   “Potts wants us to wander, to explore, to embrace the unknown, and, finally, to take our own damn time about it. I think this is the most sensible book of travel-related advice ever written.”—Tim Cahill, founding editor of Outside ...more",Travel
https://books.toscrape.com/media/cache/45/21/4521c581ba727f5c835e34860cbf53e5.jpg,a94350ee74deaa07,Books,37.33,37.33,0.00,In stock (7 available),0,https://books.toscrape.com/catalogue/under-the-tuscan-sun_504/index.html,Under the Tuscan Sun,"A CLASSIC FROM THE BESTSELLING AUTHOR OF UNDER MAGNOLIAFrances Mayes—widely published poet, gourmet cook, and travel writer—opens the door to a wondrous new world when she buys and restores an abandoned villa in the spectacular Tuscan countryside. In evocative language, she brings the reader along as she discovers the beauty and simplicity of life in Italy. Mayes also crea A CLASSIC FROM THE BESTSELLING AUTHOR OF UNDER MAGNOLIAFrances Mayes—widely published poet, gourmet cook, and travel writer—opens the door to a wondrous new world when she buys and restores an abandoned villa in the spectacular Tuscan countryside. In evocative language, she brings the reader along as she discovers the beauty and simplicity of life in Italy. Mayes also creates dozens of delicious seasonal recipes from her traditional kitchen and simple garden, all of which she includes in the book. Doing for Tuscany what M.F.K. Fisher and Peter Mayle did for Provence, Mayes writes about the tastes and pleasures of a foreign country with gusto and passion. ...more",Travel
https://books.toscrape.com/media/cache/6c/e3/6ce3003931701c7a3fd5354917538ea9.jpg,cc1936a9f4e93477,Books,44.34,44.34,0.00,In stock (7 available),0,https://books.toscrape.com/catalogue/a-summer-in-europe_458/index.html,A Summer In Europe,"On her thirtieth birthday, Gwendolyn Reese receives an unexpected present from her widowed Aunt Bea: a grand tour of Europe in the company of Bea's Sudoku and Mahjongg Club. The prospect isn't entirely appealing. But when the gift she is expecting--an engagement ring from her boyfriend--doesn't materialize, Gwen decides to go. At first, Gwen approaches the trip as if it's On her thirtieth birthday, Gwendolyn Reese receives an unexpected present from her widowed Aunt Bea: a grand tour of Europe in the company of Bea's Sudoku and Mahjongg Club. The prospect isn't entirely appealing. But when the gift she is expecting--an engagement ring from her boyfriend--doesn't materialize, Gwen decides to go. At first, Gwen approaches the trip as if it's the math homework she assigns her students, diligently checking monuments off her must-see list. But amid the bougainvillea and stunning vistas of southern Italy, something changes. Gwen begins to live in the moment--skipping down stone staircases in Capri, running her fingers over a glacier in view of the Matterhorn, racing through the Louvre, and taste-testing pastries at a Marseilles cafe. Reveling in every new experience--especially her attraction to a charismatic British physics professor--Gwen discovers that the ancient wonders around her are nothing compared to the renaissance unfolding within. . . ""A thinking woman's love story, it swept me away to breathtaking places with a cast of endearing characters I won't soon forget. Bravissima!"" Susan McBride, author of ""Little Black Dress"" Praise for Marilyn Brant's According to Jane ""A warm, witty and charmingly original story."" --Susan Wiggs, ""New York Times "" bestselling author ""Brant infuses her sweetly romantic and delightfully clever tale with just the right dash of Austen-esque wit."" ""Chicago Tribune"" ""An engaging read for all who have been through the long, dark, dating wars, and still believe there's sunshine, and a Mr. Darcy, at the end of the tunnel."" --Cathy Lamb, author of ""Such a Pretty Face"""" ...more",Travel
https://books.toscrape.com/media/cache/d5/82/d582f6b0261c2842330e893962276295.jpg,48736df57e7bec9f,Books,30.54,30.54,0.00,In stock (6 available),0,https://books.toscrape.com/catalogue/the-great-railway-bazaar_446/index.html,The Great Railway Bazaar,"First published more than thirty years ago, Paul Theroux's strange, unique, and hugely entertaining railway odyssey has become a modern classic of travel literature. Here Theroux recounts his early adventures on an unusual grand continental tour. Asia's fabled trains -- the Orient Express, the Khyber Pass Local, the Frontier Mail, the Golden Arrow to Kuala Lumpur, the Mand First published more than thirty years ago, Paul Theroux's strange, unique, and hugely entertaining railway odyssey has become a modern classic of travel literature. Here Theroux recounts his early adventures on an unusual grand continental tour. Asia's fabled trains -- the Orient Express, the Khyber Pass Local, the Frontier Mail, the Golden Arrow to Kuala Lumpur, the Mandalay Express, the Trans-Siberian Express -- are the stars of a journey that takes him on a loop eastbound from London's Victoria Station to Tokyo Central, then back from Japan on the Trans-Siberian. Brimming with Theroux's signature humor and wry observations, this engrossing chronicle is essential reading for both the ardent adventurer and the armchair traveler. ...more",Travel
https://books.toscrape.com/media/cache/8b/81/8b81cd9b2c8f89a12099a80bed1c4911.jpg,9e60929f521fa280,Books,56.88,56.88,0.00,In stock (6 available),0,https://books.toscrape.com/catalogue/a-year-in-provence-provence-1_421/index.html,A Year in Provence (Provence #1),"National BestsellerIn this witty and warm-hearted account, Peter Mayle tells what it is like to realize a long-cherished dream and actually move into a 200-year-old stone farmhouse in the remote country of the Lubéron with his wife and two large dogs. He endures January's frosty mistral as it comes howling down the Rhône Valley, discovers the secrets of goat racing through National Bestseller In this witty and warm-hearted account, Peter Mayle tells what it is like to realize a long-cherished dream and actually move into a 200-year-old stone farmhouse in the remote country of the Lubéron with his wife and two large dogs. He endures January's frosty mistral as it comes howling down the Rhône Valley, discovers the secrets of goat racing through the middle of town, and delights in the glorious regional cuisine. A Year in Provence transports us into all the earthy pleasures of Provençal life and lets us live vicariously at a tempo governed by seasons, not by days. ...more",Travel
https://books.toscrape.com/media/cache/26/f5/26f5d20239a45046e756c6d09611b3ea.jpg,366a236aa1ea6f07,Books,23.21,23.21,0.00,In stock (3 available),0,https://books.toscrape.com/catalogue/the-road-to-little-dribbling-adventures-of-an-american-in-britain-notes-from-a-small-island-2_277/index.html,The Road to Little Dribbling: Adventures of an American in Britain (Notes From a Small Island #2),"The hilarious and loving sequel to a hilarious and loving classic of travel writing: Notes from a Small Island, Bill Bryson’s valentine to his adopted country of EnglandIn 1995 Bill Bryson got into his car and took a weeks-long farewell motoring trip about England before moving his family back to the United States. The book about that trip, Notes from a Small Island, is up The hilarious and loving sequel to a hilarious and loving classic of travel writing: Notes from a Small Island, Bill Bryson’s valentine to his adopted country of EnglandIn 1995 Bill Bryson got into his car and took a weeks-long farewell motoring trip about England before moving his family back to the United States. The book about that trip, Notes from a Small Island, is uproarious and endlessly endearing, one of the most acute and affectionate portrayals of England in all its glorious eccentricity ever written. Two decades later, he set out again to rediscover that country, and the result is The Road to Little Dribbling. Nothing is funnier than Bill Bryson on the road—prepare for the total joy and multiple episodes of unseemly laughter. ...more",Travel
https://books.toscrape.com/media/cache/c9/9a/c99a7a05537cd842eb4db83d537e3a4d.jpg,747cf7fca2ccdbd4,Books,38.95,38.95,0.00,In stock (3 available),0,https://books.toscrape.com/catalogue/neither-here-nor-there-travels-in-europe_198/index.html,Neither Here nor There: Travels in Europe,"Bill Bryson's first travel book, The Lost Continent, was unanimously acclaimed as one of the funniest books in years. In Neither Here nor There he brings his unique brand of humour to bear on Europe as he shoulders his backpack, keeps a tight hold on his wallet, and journeys from Hammerfest, the northernmost town on the continent, to Istanbul on the cusp of Asia. Fluent in Bill Bryson's first travel book, The Lost Continent, was unanimously acclaimed as one of the funniest books in years. In Neither Here nor There he brings his unique brand of humour to bear on Europe as he shoulders his backpack, keeps a tight hold on his wallet, and journeys from Hammerfest, the northernmost town on the continent, to Istanbul on the cusp of Asia. Fluent in, oh, at least one language, he retraces his travels as a student twenty years before.Whether braving the homicidal motorist of Paris, being robbed by gypsies in Florence, attempting not to order tripe and eyeballs in a German restaurant, window-shopping in the sex shops of the Reeperbahn or disputing his hotel bill in Copenhagen, Bryson takes in the sights, dissects the culture and illuminates each place and person with his hilariously caustic observations. He even goes to Liechtenstein. ...more",Travel
https://books.toscrape.com/media/cache/9e/10/9e106f81f65b293e488718a4f54a6a3f.jpg,228ba5e7577e1d49,Books,26.08,26.08,0.00,In stock (1 available),0,https://books.toscrape.com/catalogue/1000-places-to-see-before-you-die_1/index.html,"1,000 Places to See Before You Die","Around the World, continent by continent, here is the best the world has to offer: 1,000 places guaranteed to give travelers the shivers. Sacred ruins, grand hotels, wildlife preserves, hilltop villages, snack shacks, castles, festivals, reefs, restaurants, cathedrals, hidden islands, opera houses, museums, and more. Each entry tells exactly why it's essential to visit. Th Around the World, continent by continent, here is the best the world has to offer: 1,000 places guaranteed to give travelers the shivers. Sacred ruins, grand hotels, wildlife preserves, hilltop villages, snack shacks, castles, festivals, reefs, restaurants, cathedrals, hidden islands, opera houses, museums, and more. Each entry tells exactly why it's essential to visit. Then come the nuts and bolts: addresses, websites, phone and fax numbers, best times to visit. Stop dreaming and get going.This hefty volume reminds vacationers that hot tourist spots are small percentage of what's worth seeing out there. A quick sampling: Venice's Cipriani Hotel; California's Monterey Peninsula; the Lewis and Clark Trail in Oregon; the Great Wall of China; Robert Louis Stevenson's home in Western Samoa; and the Alhambra in Andalusia, Spain. Veteran travel guide writer Schultz divides the book geographically, presenting a little less than a page on each location. Each entry lists exactly where to find the spot (e.g. Moorea is located ""12 miles/19 km northwest of Tahiti; 10 minutes by air, 1 hour by boat"") and when to go (e.g., if you want to check out The Complete Fly Fisher hotel in Montana, ""May and Sept.-Oct. offer productive angling in a solitary setting""). This is an excellent resource for the intrepid traveler.Copyright 2003 Reed Business Information, Inc. ...more",Travel
https://books.toscrape.com/media/cache/c0/59/c05972805aa7201171b8fc71a5b00292.jpg,e00eb4fd7b871a48,Books,47.82,47.82,0.00,In stock (20 available),0,https://books.toscrape.com/catalogue/sharp-objects_997/index.html,Sharp Objects,"WICKED above her hipbone, GIRL across her heart Words are like a road map to reporter Camille Preaker’s troubled past. Fresh from a brief stay at a psych hospital, Camille’s first assignment from the second-rate daily paper where she works brings her reluctantly back to her hometown to cover the murders of two preteen girls. NASTY on her kneecap, BABYDOLL on her leg Since WICKED above her hipbone, GIRL across her heart Words are like a road map to reporter Camille Preaker’s troubled past. Fresh from a brief stay at a psych hospital, Camille’s first assignment from the second-rate daily paper where she works brings her reluctantly back to her hometown to cover the murders of two preteen girls. NASTY on her kneecap, BABYDOLL on her leg Since she left town eight years ago, Camille has hardly spoken to her neurotic, hypochondriac mother or to the half-sister she barely knows: a beautiful thirteen-year-old with an eerie grip on the town. Now, installed again in her family’s Victorian mansion, Camille is haunted by the childhood tragedy she has spent her whole life trying to cut from her memory. HARMFUL on her wrist, WHORE on her ankle As Camille works to uncover the truth about these violent crimes, she finds herself identifying with the young victims—a bit too strongly. Clues keep leading to dead ends, forcing Camille to unravel the psychological puzzle of her own past to get at the story. Dogged by her own demons, Camille will have to confront what happened to her years before if she wants to survive this homecoming.With its taut, crafted writing, Sharp Objects is addictive, haunting, and unforgettable. ...more",Mystery
https://books.toscrape.com/media/cache/95/84/95840dfd67c020067c99d70451147e20.jpg,19ed25f4641d5efd,Books,19.63,19.63,0.00,In stock (18 available),0,https://books.toscrape.com/catalogue/in-a-dark-dark-wood_963/index.html,"In a Dark, Dark Wood","In a dark, dark wood Nora hasn't seen Clare for ten years. Not since Nora walked out of school one day and never went back. There was a dark, dark houseUntil, out of the blue, an invitation to Clare’s hen do arrives. Is this a chance for Nora to finally put her past behind her?And in the dark, dark house there was a dark, dark roomBut something goes wrong. Very wrong.And i In a dark, dark wood Nora hasn't seen Clare for ten years. Not since Nora walked out of school one day and never went back. There was a dark, dark houseUntil, out of the blue, an invitation to Clare’s hen do arrives. Is this a chance for Nora to finally put her past behind her?And in the dark, dark house there was a dark, dark roomBut something goes wrong. Very wrong.And in the dark, dark room.... Some things can’t stay secret for ever. ...more",Mystery
https://books.toscrape.com/media/cache/9d/f2/9df248dcefeaba9eeb519a59b248f72c.jpg,5ee94540d0749ea0,Books,56.50,56.50,0.00,In stock (16 available),0,https://books.toscrape.com/catalogue/the-past-never-ends_942/index.html,The Past Never Ends,"A simple task, Attorney Chester Morgan thinks. Get a copy of a public record for a young man whose only friend has died in an unexplained accidental death. Except... The police file regarding the demise of sex worker Tanya Everly has been sealed by the order of the chief of police, and no one will talk. Warned to drop the matter, Attorney Morgan knows that if he doesn't sp A simple task, Attorney Chester Morgan thinks. Get a copy of a public record for a young man whose only friend has died in an unexplained accidental death. Except... The police file regarding the demise of sex worker Tanya Everly has been sealed by the order of the chief of police, and no one will talk. Warned to drop the matter, Attorney Morgan knows that if he doesn't speak for the dead young woman, no one will. Haunted by his discovery of the body of a prominent local oilman, Morgan pursues a quest for justice that puts his reputation, career, and life at risk. A journey that takes him into the dark shadows of the sex-for-sale business, into the marble courtrooms of Oklahoma, and into the aching loneliness of his own soul. Set in the American Southwest in the days before 9/11, The Past Never Ends is both a complex murder mystery and a meditation on the self-perpetuating nature of injustice and the ethereal nature of justice itself. ...more",Mystery
https://books.toscrape.com/media/cache/cc/bd/ccbd7a62caefd5a3a2e04dd7c2ff48fe.jpg,f733e8c19d40ec2e,Books,16.64,16.64,0.00,In stock (16 available),0,https://books.toscrape.com/catalogue/a-murder-in-time_877/index.html,A Murder in Time,"Beautiful and brilliant, Kendra Donovan is a rising star at the FBI. Yet her path to professional success hits a speed bump during a disastrous raid where half her team is murdered, a mole in the FBI is uncovered and she herself is severely wounded. As soon as she recovers, she goes rogue and travels to England to assassinate the man responsible for the deaths of her teamm Beautiful and brilliant, Kendra Donovan is a rising star at the FBI. Yet her path to professional success hits a speed bump during a disastrous raid where half her team is murdered, a mole in the FBI is uncovered and she herself is severely wounded. As soon as she recovers, she goes rogue and travels to England to assassinate the man responsible for the deaths of her teammates.While fleeing from an unexpected assassin herself, Kendra escapes into a stairwell that promises sanctuary but when she stumbles out again, she is in the same place - Aldrich Castle - but in a different time: 1815, to be exact.Mistaken for a lady's maid hired to help with weekend guests, Kendra is forced to quickly adapt to the time period until she can figure out how she got there; and, more importantly, how to get back home. However, after the body of a young girl is found on the extensive grounds of the county estate, she starts to feel there's some purpose to her bizarre circumstances. Stripped of her twenty-first century tools, Kendra must use her wits alone in order to unmask a cunning madman. ...more",Mystery
